{
  "vehicle_id": "vehicle_helix7",
  "display_name": "HELIX 7",
  "class": "sports",
  "faction_affiliation": null,
  "stats": {
    "top_speed_kmh": 240,
    "acceleration": 0.92,
    "braking": 0.78,
    "handling": 0.90,
    "durability_hp": 280,
    "weight_class": "light",
    "drive_type": "rear_wheel"
  },
  "damage_zones": {
    "front":      { "hp": 60, "effect_on_deplete": "reduced_ram" },
    "engine":     { "hp": 80, "effect_on_deplete": "speed_penalty_50pct" },
    "tires":      { "hp": 40, "effect_on_deplete": "handling_penalty_severe" },
    "fuel_tank":  { "hp": 50, "effect_on_deplete": "fire_trail" }
  },
  "traction_modifiers": {
    "wet": 0.75,
    "gravel": 0.85,
    "ice": 0.60
  },
  "seats": 2,
  "can_be_stolen": true,
  "spawn_districts": ["neon_flats", "the_grid"],
  "spawn_weight": 3,
  "price_shop": 22000,
  "unlock_condition": "mission_redline_win",
  "audio_engine_id": "snd_engine_sports_high",
  "model_path": "res://assets/vehicles/helix7/vehicle_helix7.tscn"
}
